{
  "schemaVersion": "1.0.0",
  "dataVersion": "P140-V0.001-demo",
  "timezone": "Asia/Taipei",
  "generatedAt": "2026-10-23",
  "isDemo": true,
  "displaySettings": {
    "stopLabelBeforeArrivalSec": 30,
    "stopLabelAfterDepartureSec": 15
  },
  "routes": [
    {
      "routeId": "demo_red2",
      "shortName": "紅2",
      "name": "紅2｜校園展示線（虛構路線）",
      "color": "#b64f45",
      "isDemo": true,
      "sources": {
        "synthetic_stops": {
          "kind": "synthetic",
          "description": "介面測試用示意站點，非已查證站牌。"
        },
        "osrm_roads": {
          "kind": "routing",
          "description": "OSRM driving / OpenStreetMap 道路候選；未確認為實際公車行駛路線。",
          "url": "https://project-osrm.org/",
          "retrievedAt": "2026-10-23"
        },
        "synthetic_timing": {
          "kind": "estimated",
          "description": "以道路路由時間乘1.5及停站20秒合成，僅供原型測試。"
        },
        "synthetic_schedule": {
          "kind": "synthetic",
          "description": "所有發車時間與適用星期均為測試資料，不是官方班表。"
        }
      },
      "stops": {
        "demo_red2_outbound_s01": {
          "name": "慈濟大學〔示意站〕",
          "coord": [
            121.588297,
            23.993626
          ],
          "sourceId": "synthetic_stops",
          "verificationStatus": "illustrative"
        },
        "demo_red2_outbound_s02": {
          "name": "校園東站〔虛構〕",
          "coord": [
            121.59365,
            23.993969
          ],
          "sourceId": "synthetic_stops",
          "verificationStatus": "illustrative"
        },
        "demo_red2_outbound_s03": {
          "name": "花蓮轉運站〔示意〕",
          "coord": [
            121.603693,
            23.991057
          ],
          "sourceId": "synthetic_stops",
          "verificationStatus": "illustrative"
        },
        "demo_red2_outbound_s04": {
          "name": "市區中站〔虛構〕",
          "coord": [
            121.606773,
            23.98604
          ],
          "sourceId": "synthetic_stops",
          "verificationStatus": "illustrative"
        },
        "demo_red2_outbound_s05": {
          "name": "市區南站〔虛構〕",
          "coord": [
            121.603597,
            23.980837
          ],
          "sourceId": "synthetic_stops",
          "verificationStatus": "illustrative"
        },
        "demo_red2_outbound_s06": {
          "name": "西城站〔虛構〕",
          "coord": [
            121.596045,
            23.979669
          ],
          "sourceId": "synthetic_stops",
          "verificationStatus": "illustrative"
        },
        "demo_red2_inbound_s01": {
          "name": "西城站〔虛構〕",
          "coord": [
            121.596045,
            23.979669
          ],
          "sourceId": "synthetic_stops",
          "verificationStatus": "illustrative"
        },
        "demo_red2_inbound_s02": {
          "name": "市區南站〔虛構〕",
          "coord": [
            121.603597,
            23.980837
          ],
          "sourceId": "synthetic_stops",
          "verificationStatus": "illustrative"
        },
        "demo_red2_inbound_s03": {
          "name": "市區中站〔虛構〕",
          "coord": [
            121.606773,
            23.98604
          ],
          "sourceId": "synthetic_stops",
          "verificationStatus": "illustrative"
        },
        "demo_red2_inbound_s04": {
          "name": "花蓮轉運站〔示意〕",
          "coord": [
            121.603693,
            23.991057
          ],
          "sourceId": "synthetic_stops",
          "verificationStatus": "illustrative"
        },
        "demo_red2_inbound_s05": {
          "name": "校園東站〔虛構〕",
          "coord": [
            121.59365,
            23.993969
          ],
          "sourceId": "synthetic_stops",
          "verificationStatus": "illustrative"
        },
        "demo_red2_inbound_s06": {
          "name": "慈濟大學〔示意站〕",
          "coord": [
            121.588297,
            23.993626
          ],
          "sourceId": "synthetic_stops",
          "verificationStatus": "illustrative"
        }
      },
      "patterns": {
        "demo_red2_outbound": {
          "direction": "outbound",
          "headsign": "西城站〔虛構〕",
          "path": [
            [
              121.588297,
              23.993626
            ],
            [
              121.588403,
              23.993768
            ],
            [
              121.588479,
              23.993874
            ],
            [
              121.58853,
              23.994028
            ],
            [
              121.5885,
              23.99413
            ],
            [
              121.588805,
              23.994559
            ],
            [
              121.588792,
              23.99466
            ],
            [
              121.588796,
              23.99472
            ],
            [
              121.58884,
              23.994796
            ],
            [
              121.589374,
              23.995409
            ],
            [
              121.589488,
              23.995322
            ],
            [
              121.589704,
              23.995259
            ],
            [
              121.590027,
              23.994956
            ],
            [
              121.59,
              23.994771
            ],
            [
              121.5899,
              23.994582
            ],
            [
              121.589792,
              23.994406
            ],
            [
              121.589543,
              23.994201
            ],
            [
              121.590381,
              23.993606
            ],
            [
              121.591155,
              23.992936
            ],
            [
              121.59129,
              23.993064
            ],
            [
              121.59158,
              23.992815
            ],
            [
              121.591625,
              23.992769
            ],
            [
              121.591846,
              23.99259
            ],
            [
              121.592047,
              23.992423
            ],
            [
              121.592211,
              23.992246
            ],
            [
              121.592359,
              23.992028
            ],
            [
              121.592467,
              23.991804
            ],
            [
              121.592829,
              23.99233
            ],
            [
              121.592448,
              23.992755
            ],
            [
              121.592463,
              23.992829
            ],
            [
              121.592516,
              23.99291
            ],
            [
              121.593159,
              23.993498
            ],
            [
              121.59365,
              23.993969
            ],
            [
              121.593706,
              23.994023
            ],
            [
              121.593749,
              23.994029
            ],
            [
              121.59379,
              23.994017
            ],
            [
              121.594186,
              23.993626
            ],
            [
              121.594547,
              23.993941
            ],
            [
              121.595019,
              23.994358
            ],
            [
              121.595498,
              23.994796
            ],
            [
              121.597064,
              23.992795
            ],
            [
              121.597266,
              23.992519
            ],
            [
              121.597662,
              23.992054
            ],
            [
              121.598271,
              23.991257
            ],
            [
              121.599139,
              23.990147
            ],
            [
              121.599566,
              23.989599
            ],
            [
              121.600221,
              23.988762
            ],
            [
              121.600633,
              23.989114
            ],
            [
              121.601194,
              23.989724
            ],
            [
              121.60139,
              23.989931
            ],
            [
              121.601422,
              23.989966
            ],
            [
              121.6015,
              23.990059
            ],
            [
              121.602208,
              23.99082
            ],
            [
              121.602761,
              23.991455
            ],
            [
              121.602861,
              23.991578
            ],
            [
              121.603505,
              23.991175
            ],
            [
              121.603693,
              23.991057
            ],
            [
              121.604027,
              23.990849
            ],
            [
              121.604128,
              23.990793
            ],
            [
              121.604666,
              23.99044
            ],
            [
              121.605077,
              23.990195
            ],
            [
              121.605199,
              23.990159
            ],
            [
              121.605365,
              23.990167
            ],
            [
              121.605565,
              23.990213
            ],
            [
              121.605669,
              23.990244
            ],
            [
              121.605989,
              23.98894
            ],
            [
              121.606206,
              23.988044
            ],
            [
              121.606319,
              23.987978
            ],
            [
              121.606491,
              23.987914
            ],
            [
              121.606896,
              23.987762
            ],
            [
              121.607155,
              23.98759
            ],
            [
              121.607402,
              23.987364
            ],
            [
              121.607422,
              23.987345
            ],
            [
              121.60768,
              23.987068
            ],
            [
              121.607862,